{
  "id": "devrel-onboard",
  "version": "1.0.0",
  "layer": "product",
  "chapter": "謀攻 — Attack by Stratagem",
  "display": {
    "name_en": "Developer Onboard",
    "icon": "",
    "description_en": "Time-to-first-success tracking"
  },
  "execution": {
    "agents": ["devrel-engineer"],
    "hub": "devrel-hub",
    "complexity": "standard",
    "timeout_ms": 120000,
    "credit_cost": 2,
    "requires_approval": false
  },
  "input": {
    "type": "object",
    "required": ["goal"],
    "properties": {
      "goal": { "type": "string", "description": "Natural language task" }
    }
  },
  "output": {
    "type": "object",
    "properties": {
      "result": { "type": "string" },
      "artifacts": { "type": "array", "items": { "type": "string" } }
    }
  },
  "cascade": { "triggers": [] },
  "validation": {
    "output_must_contain": [],
    "min_output_length": 50,
    "max_credit_cost": 5
  }
}
