{
  "id": "intel-asymmetry",
  "version": "1.0.0",
  "layer": "product",
  "chapter": "虛實 — Void and Substance",
  "display": {
    "name_en": "Info Asymmetry",
    "icon": "",
    "description_en": "Exploit information asymmetry for competitive advantage"
  },
  "execution": {
    "agents": ["strategy-analyst"],
    "hub": "intel-hub",
    "complexity": "standard",
    "timeout_ms": 120000,
    "credit_cost": 3,
    "requires_approval": false
  },
  "input": {
    "type": "object",
    "required": ["goal"],
    "properties": {
      "goal": { "type": "string", "description": "Natural language task" }
    }
  },
  "output": {
    "type": "object",
    "properties": {
      "result": { "type": "string" },
      "artifacts": { "type": "array", "items": { "type": "string" } }
    }
  },
  "cascade": { "triggers": [] },
  "validation": {
    "output_must_contain": [],
    "min_output_length": 50,
    "max_credit_cost": 5
  }
}
