{
  "id": "qa-accessibility",
  "version": "1.0.0",
  "layer": "engineering",
  "chapter": "行軍 — Army on the March",
  "display": {
    "name_en": "Accessibility Audit",
    "icon": "",
    "description_en": "WCAG AA accessibility audit"
  },
  "execution": {
    "agents": ["qa-engineer", "ux-designer"],
    "hub": "qa-hub",
    "complexity": "standard",
    "timeout_ms": 120000,
    "credit_cost": 2,
    "requires_approval": false
  },
  "input": {
    "type": "object",
    "required": ["goal"],
    "properties": {
      "goal": { "type": "string", "description": "Natural language task" }
    }
  },
  "output": {
    "type": "object",
    "properties": {
      "result": { "type": "string" },
      "artifacts": { "type": "array", "items": { "type": "string" } }
    }
  },
  "cascade": { "triggers": [] },
  "validation": {
    "output_must_contain": [],
    "min_output_length": 50,
    "max_credit_cost": 5
  }
}
