{
  "id": "sec-soc",
  "version": "1.0.0",
  "layer": "ops",
  "chapter": "行軍 — Army on the March",
  "display": {
    "name_en": "SOC Dashboard",
    "icon": "",
    "description_en": "Security operations center — SIEM ingestion, alert correlation, threat detection"
  },
  "execution": {
    "agents": ["soc-analyst"],
    "hub": "security-hub",
    "complexity": "simple",
    "timeout_ms": 120000,
    "credit_cost": 2,
    "requires_approval": false
  },
  "input": {
    "type": "object",
    "required": ["goal"],
    "properties": {
      "goal": { "type": "string", "description": "Natural language task" }
    }
  },
  "output": {
    "type": "object",
    "properties": {
      "result": { "type": "string" },
      "artifacts": { "type": "array", "items": { "type": "string" } }
    }
  },
  "cascade": { "triggers": [] },
  "validation": {
    "output_must_contain": [],
    "min_output_length": 50,
    "max_credit_cost": 5
  }
}
