{
  "id": "pm-feedback",
  "version": "1.0.0",
  "layer": "product",
  "chapter": "軍爭 — Armed Struggle",
  "display": {
    "name_en": "User Feedback",
    "icon": "",
    "description_en": "User feedback collection routed to backlog"
  },
  "execution": {
    "agents": ["product-manager"],
    "hub": "product-hub",
    "complexity": "simple",
    "timeout_ms": 120000,
    "credit_cost": 2,
    "requires_approval": false
  },
  "input": {
    "type": "object",
    "required": ["goal"],
    "properties": {
      "goal": { "type": "string", "description": "Natural language task" }
    }
  },
  "output": {
    "type": "object",
    "properties": {
      "result": { "type": "string" },
      "artifacts": { "type": "array", "items": { "type": "string" } }
    }
  },
  "cascade": { "triggers": [] },
  "validation": {
    "output_must_contain": [],
    "min_output_length": 50,
    "max_credit_cost": 5
  }
}
