{
  "id": "studio-operate-daily",
  "version": "1.0.0",
  "layer": "founder",
  "chapter": "九變 — Nine Variations",
  "display": {
    "name_en": "Daily Operations",
    "icon": "",
    "description_en": "Daily operations checklist for studio"
  },
  "execution": {
    "agents": [
      "founder-ops"
    ],
    "hub": "founder-hub",
    "complexity": "standard",
    "timeout_ms": 120000,
    "credit_cost": 3,
    "requires_approval": false
  },
  "input": {
    "type": "object",
    "required": [
      "goal"
    ],
    "properties": {
      "goal": {
        "type": "string",
        "description": "Natural language task description"
      }
    }
  },
  "output": {
    "type": "object",
    "properties": {
      "summary": {
        "type": "string"
      },
      "action_items": {
        "type": "array",
        "items": {
          "type": "string"
        }
      },
      "metrics": {
        "type": "object",
        "description": "Key metrics and KPIs"
      }
    }
  },
  "cascade": {
    "triggers": []
  },
  "validation": {
    "output_must_contain": [],
    "min_output_length": 50,
    "max_credit_cost": 5
  }
}