{
  "id": "ir-metrics",
  "version": "1.0.0",
  "layer": "founder",
  "chapter": "用間 — Use of Intelligence",
  "display": {
    "name_en": "Investor Metrics",
    "icon": "",
    "description_en": "Automated SaaS metrics for investors — ARR, NRR, Rule of 40"
  },
  "execution": {
    "agents": ["ir-lead", "data-analyst"],
    "hub": "ir-hub",
    "complexity": "standard",
    "timeout_ms": 120000,
    "credit_cost": 3,
    "requires_approval": false
  },
  "input": {
    "type": "object",
    "required": ["goal"],
    "properties": {
      "goal": { "type": "string", "description": "Natural language task" }
    }
  },
  "output": {
    "type": "object",
    "properties": {
      "result": { "type": "string" },
      "artifacts": { "type": "array", "items": { "type": "string" } }
    }
  },
  "cascade": { "triggers": [] },
  "validation": {
    "output_must_contain": [],
    "min_output_length": 50,
    "max_credit_cost": 5
  }
}
