{
  "id": "esg-report",
  "version": "1.0.0",
  "layer": "founder",
  "chapter": "九變 — Nine Variations",
  "display": {
    "name_en": "ESG Report",
    "icon": "",
    "description_en": "Sustainability reporting with GRI/SASB frameworks"
  },
  "execution": {
    "agents": ["esg-analyst", "legal"],
    "hub": "esg-hub",
    "complexity": "standard",
    "timeout_ms": 120000,
    "credit_cost": 3,
    "requires_approval": false
  },
  "input": {
    "type": "object",
    "required": ["goal"],
    "properties": {
      "goal": { "type": "string", "description": "Natural language task" }
    }
  },
  "output": {
    "type": "object",
    "properties": {
      "result": { "type": "string" },
      "artifacts": { "type": "array", "items": { "type": "string" } }
    }
  },
  "cascade": { "triggers": [] },
  "validation": {
    "output_must_contain": [],
    "min_output_length": 50,
    "max_credit_cost": 5
  }
}
