{
  "id": "dealflow-screen",
  "version": "1.0.0",
  "layer": "founder",
  "chapter": "始計 — Initial Calculations",
  "display": {
    "name_en": "Dealflow Screen",
    "icon": "",
    "description_en": "Screen deal against investment thesis — five-factor quick eval. 1 command, ~5 min."
  },
  "execution": {
    "agents": [
      "general"
    ],
    "hub": "studio-hub",
    "complexity": "standard",
    "timeout_ms": 120000,
    "credit_cost": 3,
    "requires_approval": false
  },
  "input": {
    "type": "object",
    "required": [
      "goal"
    ],
    "properties": {
      "goal": {
        "type": "string",
        "description": "Natural language task"
      }
    }
  },
  "output": {
    "type": "object",
    "properties": {
      "result": {
        "type": "string"
      },
      "artifacts": {
        "type": "array",
        "items": {
          "type": "string"
        }
      }
    }
  },
  "cascade": {
    "triggers": []
  },
  "validation": {
    "output_must_contain": [],
    "min_output_length": 50,
    "max_credit_cost": 5
  }
}
